title,post,author
New official keyart for Assassin's Creed Valhalla,,t2_2tfzhaaj
Why is everybody talking about Spiderman and Cyberpunk but no about Watchdogs Legion?,"I see many many posts talking and asking about these two games and how they will look and perform on PS5 but no one ever asks about the new Watchdogs, why is that? Am I missing something about this game or people is just not interested in it?

Did Ubi say something about how it will look and perform on PS5 compared to the PS4 version?

Thanks!",t2_4y3415tv
They finally made it !!! (PS5 DualSense film protection for touchpad and face),"Greetings. Remember when I told you about that I wanted DualSense film protection for the touchpad like the DS4? then I was hopeless and I could not find anything like the the DS4 ones so I decided to get in touch with the makers who make protections for everything, they said they will try!:

https://reddit.com/r/PS5/comments/ivcwhf/ps5_dualsense_touch_pad_exact_sizes_and_dimensions/

Guess what? they responded to me and they were so quick abnd it didn't take them 2 weeks to make it and they did it, not just for the touch pad but also for the entire controller :

https://www.protectionfilms24.com/c/ALL/sony-playstation-5-controller/

In case you want to protect your valuable controller they are so amazing quality for all stuff i tried before and they are the only ones providing them",t2_h2zi6
Anybody else want a WD1 remaster?,"
Considering you get ultimate edition Watch Dogs 1 with the purchase Ultimate Edition for Watch Dogs Legion (Might be wrong edition) wouldn't it be cool to see an improved upon E3 graphical build of the game? It would surpass what we saw in the E3 presentation and would reignite the game and some may even consider it good after all the bug fixes and graphical upgrade. Chicago would be amazing with detailed streets and NPCs and those focus mode montages would look like a John wick movie no doubt.

Cool focus montage: https://youtu.be/myo7i5lWunQ",t2_2dr247kq
Regarding Miles Morales's fidelity and performance mode.,"So I've seen that the new Spiderman game has a 4k30 and 4k60 mode but I was wondering that for those of us that are still using 1080p panels if we will have a 1080p60 mode with all the graphical options maxed out like RT and more, or a 1080p120 mode without all the graphical options but the ultra-high frame rate.",t2_3tu0tjqv
How to stop getting excited for PS5?,Not getting until Mid 2021. How to stop getting excited for it?,t2_7ivjqoqu
So would my best bet to acquire a PS5 be to,Either camp outside the day before or just keep checking online?,t2_ha1ecu0
You can now pre-order Spiderman: Miles Morales on PS Store,,t2_36lj0w4q
Godfall – Cinematic intro: The Fall,,t2_ta1jm
More info on Sackboy in new blog post,,t2_ayi4j
Anyone else dislike the subscription model for games?,"Maybe I’m in the minority here but I feel there isn’t enough discussion about this. 

I’m not a big fan of the Netflix-like subscription model for games. 
I was really excited to try out services like PS Now/Game pass, but unfortunately I never touched 90% of the mediocre games they offer in the library. 

Maybe it’s just me or how I treat video games as a form of entertainment. 
It’s not like watching an average popcorn flick on Netflix and have a good time. 
I just can’t invest my time in a mediocre game and have fun. There’s nothing worse than playing a bad game. 

There are some occasional big games added to the library and majority of the users seem to be waiting only for those. And this seriously raises doubts about the value for money aspect with these subscription models. 

I really love the monthly free games offered on PlayStation Plus because for most months, they do give decent games. But this subscription model just doesn’t seem to click with me.",t2_zm0ecm7
Marvel's Spider-Man Remastered page is also up on the official PlayStation website,,t2_1hsasd
"[PSA] You can buy the Spider-Man remaster from the main menu of Miles Morales PS5, says community manager of Insomniac games",,t2_6yunzs8q
Should Apple partner with Sony to take PlayStation to the next level?,"This would be a really interesting move if apple heavily invested/ used their products with Sony like allowing AirPod compatibility, Apple Music and having iPhones link seemlessly with the PlayStation. I don’t know how you guys feel about this, but with apples investment to take on Microsoft then maybe Apple could help Sony purchase take two/activision or really make significant strides to merge Apple products with the PlayStation. I just think this would be really interesting and make the Apple vs Microsoft battle very interesting.",t2_bvr3nqb
"Slam, smash, and boost your way to fame in Destruction AllStars, coming to PS5",,t2_423we
Competition: Win a PlayStation 5 with Doritos,,t2_z70q9
Demon's Souls will have a Digital Deluxe Edition,,t2_t27vp
What fighting games should we expect for the ps5?,I know guilty gear is coming out next year but do we know if any other fighters are coming in the first year of the system? If so what would you like to see and play?,t2_1nv8bho
NBA 2K21 releasing launch day,,t2_x0yit
Spider-Man: Miles Morales (PS5) digital pre orders are up,,t2_243cwe73
"More PS5 info on Back-compat, forced vibration/adaptive triggers leaked via PlayStation store web source code",,t2_ol06r
Should I buy GOT?,It is now in sale for $44.99 but I was planning to get a PS5 this year. Should I bought it now or wait for playing it in the PS5. Is there any news about an update for upgrading it when PS5 is released?,t2_4j5ndvt3
Watchdogs Legion (PS5) or Cyberpunk (PS4 version played on PS5),I mean will watchdogs even be true next gen? Or will a PS4 version of cyberpunk but upgraded on the PS5 be just as good?,t2_3723ndlj
PlayStation plus for 50% off US and Canada.,,t2_5sl20xyf
3D Audio Compatibility Question,"So I’ve been trying to figure out what headsets are going to be compatible with PS5 3D Audio. I have a set of high quality Sennheiser RF headphones that I love and use for gaming and watching movies. I absolutely do not want to buy a different set of headphones just to experience 3D audio, but I will be pretty bummed if I can’t get that experience with my current set up. 

I’ve heard some conflicting information, most recently the remastered Spider-Man release  mentioning “Spatial 3D Audio on compatible headphones.” I wanted to know if anyone had heard anything updating what sorts of equipment will be compatible.",t2_i5cgz
PS5 Fans Are Curious if $70 Destruction AllStars Has Microtransactions,,t2_4bg4pnqj
PS5 games possibly announced tomorrow in the China Hero Project,"Sony Interactive Entertainment Shanghai will host a “Back to Campus” event on September 30 at 19:00 CST, which will feature a segment with the latest information on its China Hero Project titles, including progress updates, announcements, and footage, the company announced.

Upcoming games part of the China Hero Project initiative include:

AI: Limit by Sense Games

ANNO: Mutationem by ThinkingStars

Convallaria by Loong Force

Evotinction by Spikewave Games

F.I.S.T.: Forged in Shadow Torch by Ti Games

In Nightmare by Magicfish Studio

Lost Soul Aside by Ultizero Games

Pervader by Beijing Light &amp; Digital Technology

RAN: Lost Islands by Jolly Roger",t2_326k7g68
PS5 running Demon Souls Demo at 60fps and 1440p (QHD)... Is this a good indicator that PS5 will support 1440p output?,,t2_hfrox
Sony should add Google Drive/Dropbox backup for screenshots and videos on PS5,"It would help a lot if we could backup screenshots and videos to Google Drive or Dropbox so it is easier to grab them on our PCs/smartphones. On PS4 we either need to have a USB drive in hand or we send screenshots (one by one) as a message to a dummy account.  The only alteranative for videos is sending them to Youtube and download them later.

I hope Sony allows us to link our Google or Dropbox accounts on PS5 so we can make auto/manual backups. It will probably take a long time but I hope they at least consider it throughout PS5 lifecycle.

EDIT

In my first draft of this post I suggested OneDrive alongside Google Drive and Dropbox but then I realized how stupid that was, lol.",t2_qo7n5
"With everyone getting hyped for one game or another, which game(S) will you NOT be getting?","Personally I have no desire to get any sports games, godfall, and dirt 5",t2_c5x6l
Dualsense internals Pics,,t2_6ho1mmcv
First-Party Titles Run At 4K@30 or Dynamic 4K@60?,"So on the Spider-Man Remastered page, it says, [Link](https://www.playstation.com/en-us/games/marvels-spider-man-remastered/);

&gt;Experience the critically acclaimed hit with updated graphical assets and in stunning dynamic 4K/HDR\*. And experience swinging through New York and combat as an experienced Spider-Man with an optional performance mode that takes advantage of Insomniac’s temporal injection for dynamic 4K/60fps\*.

We have also been told that;

&gt;and the same optional performance mode offered on Marvel’s Spider-Man: Miles Morales, allowing you to finally play the game at a targeted 60fps frame rate.

We also know that Demon's Souls, at least in the trailer, according to DF was rendering internally at 1440p and then upscaled to 4K so basically Dynamic 4K right?

Does this mean that in quality mode the games will run at 4K@30fps with ray-tracing and in performance mode, it will run in Dynamic 4K@60fps without downgrading graphical fidelity so raytracing still on?

Even if it is up to the dev, it seems that Miles Morales, Spider-Man Remastered, Ratchet &amp; Clank: Rift Apart and Demon's Souls will have these 2 choices, they seem to be using Insomniac's Temporal Injection method,

&gt;which takes a lower internal resolution and uses prior/upcoming frames as well as AA to fill in the details to get a 4K image. It's another way of upscaling, like checkerboarding is, but temporal injection gives a cleaner image. Before DLSS 2.0 it was probably the best quality upscaling method.

&amp;#x200B;",t2_249ymeyg
I think PlayStation is letting Microsoft have the spotlight right now because once demonstrations of PS5 UI and loading into games happen it's going to drop jaws how fast PS5 really is.,"I'm sure you've heard how fast PS5 is Multiple times but reading the latest Gameinformer it blew me away. 

Kena Bridge of Spirits article one of the Game Informer staff got a hands on with actual PS5 hardware. He said he seen glimpse of the UI before the developer scrolled over the Kena game icon and hit play. 

He said the game loaded from PS5 Menu to gameplay in 2 Seconds. That's astounding. That's not loading into game seeing Menu then hitting play. That's hitting play from PS5 UI to game. 2 Seconds. Insane. 

This is probably old news but had to share anyway.


From Article

We start PS5s menu screen. Before I can see to much Mike moves over to the Kena Icon selects it and presses play. Two seconds later we're in the game. That's the load Josh says perhaps sensing my astonishment. They have a whole thing set up where you can do transitions and it's very nice,but frankly it doesn't have time to play the animation he adds. It just loads the game so fast.",t2_10cf08
"It seems that playing video games early has a great positive effect onto your memory, says this neuroscience study. So ready for the PS5?","While a number of studies have shown that video games can cause structural or functional changes in the brain, including the activation of areas responsible for attention or spatial and visual skills, this new work reveals lasting beneficial effects on memory when practiced in childhood. A recent study from Neuroscience researchers of the University of Barcelona finds that playing video games during childhood improves memory sustainably.

Study is available here: [https://www.frontiersin.org/articles/10.3389/fnhum.2020.00235/full](https://www.frontiersin.org/articles/10.3389/fnhum.2020.00235/full)

This new research, was carried out by a team of researchers from the Universitat Oberta de Catalunya (UOC) and involving 27 subjects between the ages of 18 and 40, showed that beneficial cognitive changes could occur years after giving up playing games. video games.

I game since my very young age of 6, i can confirm that my memory still works fine at 40+. 

What about you? Did you start gaming long time ago? Are you going to start with PS5? Do you think that these studies should enable governments to support gaming better? Let's maybe having a super ministry/secretary (in US) of Sport and eSport? or of Video Games? (seriously...)

Now with the development of more realistic and immersive games, would the result be the same? Or do you think the next generation games that will come from PS5 soon may affect gamers differently?",t2_5lq1nflj
Cyberpunk 2077: A New Standard for Open World Games | TGS Footage Translated,,t2_83uc1iz8
Hogwarts legacy and Quidditch,Am I the only one hoping there is the option to play Quidditch in this game? I would love to compete for the Quidditch cup! Did any of you guys play Harry Potter: Quidditch World Cup? I loved that game imagine that game with the new dual sense!,t2_y5f5n97
PS5 Local Coop,"My wife and I enjoyed playing Diablo 3 and Borderlands together.

I have a two part question:

1- are there any local coop games coming out at or near launch for PS5?

2- are there any local coop games announced next year or in the near future?",t2_12xwwd
PlayStation 5 and The Environment.,,t2_1heizfvb
FILM-LIKE! - Marvel’s Spider-Man: Miles Morales // Game Engine Developer Reacts - [Video],,t2_13cvoc
Sports Gameplay Vids,"With a little more than 6 weeks to go I'm surprised we haven't seen any gameplay or real trailers for NBA 2K, Madden, or Fifa. I remember with NBA 2K14 it was a huge deal and the trailer was revealed much earlier.",t2_5b33s55b
Thinking of camping outside a store for release day,"Hello. As the title says, I'm thinking about camping outside of a store for release day. I've never done something like this before and was hoping for some general tips from people who have done it before.

Do stores generally cater to campers in any way? Like an organized line or anything? If I were to call a store (I was considering Best Buy) would they field questions about this?

Kinda just trying to get a feel for what the vibe is at these types of things, any advice is greatly appreciated.",t2_109494
Production PS5 in Dev hands?,"Just curious if any PS5 development houses outside of Sony have final retail consumer hardware in house at this time? If you can't answer that you could just shoot me a message. Okay, Thanks, Bye.",t2_kgnt9
Will there be some usage for PS4 after PS5 comes out?,You know I think if there be possibility to use PS4 like remote remote to PS5?,t2_2g18tc1z
Until You Fall - Launch Trailer | PS VR,,t2_2y55pr4z
Save files for Miles Morales transfer from PS4 to PS5. Up to studios to implement it.,,t2_11gl40
Digital owners of Yakuza: Like a Dragon on PS4 can upgrade to PS5 for free at PlayStation Store immediately on the game’s PS5 release.,,t2_t27vp
Which ps4 games will y’all be replaying or deciding to pick up now for the ps5?,"For me (coming from someone who has the og launch ps4) I’ll be replaying kingdom hearts 3(played half of it and quit it was too much cringe😭 but I’ll give it another shot), Resident evil 2, Far cry 5, and the Witcher 3. Some games that I’ll be picking up soon are Jump force(only because they announced Hiei), FF7, TLO2, and Ass’s origins. I’m hyped for the graphical difference from my og ps4 to the ps5🔥",t2_bk5bq2o
The potential PS4-PS5 save transfer issue.,"""Fair warning. This is going to be weirder that usual.""

So hear me out. I have been paying attention to this Yakuza issue with ps4 saves not transferring to ps5 and it seems it may not be the only game having this problem and by ommission and assumptions it's gone unnoticed.

I have to think that the issue has to be a technical one. There's no way an rpg that is crossplay wouldn't want to be cross-save as well. That makes me nervous about other games like AC Valhalla and Cyberpunk that are also crossplay.

Control got heat for only allowing the Ultimate edition to upgrade, but what if they knew the older version's saves wouldn't transfer either. Also the Spider-man remaster won't allow save transfer as well. So that's three.

I am no tech guy and this may be the concerns of an overthinker, but it bares considering that saves may not be as easy to transfer from one system to the other this time.

It could explain the new crunch time situation at CDPR after they promised they wouldn't. If they hit a snag like this they would grind their way to a solution (or they just told people what they wanted to hear).",t2_1dbv0e0c
Demons Souls is a real looker and this isn’t even the 4K ray tracing mode,,t2_11gl40
"I really hope that we have the ability to customize the PS5 Home Screen. It would be really cool to be able to change game icons, text font, color, etc.",,t2_7fu5kn0l
Part 2 of Hogwarts legacy information breakdown,,t2_409ryx5l
What are your favorite Playstation games of all time? What's your history (if any) with Playstation? What games are you most stoked about for PS5 and why?,"Nostalgia thread? I've been a Playstation fan since around 1996 or '97. Playstation Underground, all that silly stuff. Would love to hear from all you fans, old and new. What stories to you have? What PS games are important to you and why? What are you most excited about for the PS5? I'm super hyped. What yah got?",t2_44soo
"An interesting title, game art change option.","I would love it if they add the ability to change the game art (icon) in the PS5 UI, It should be something doable, what fo you think?",t2_usern6w
The amount of platformers revealed to be on the PS5 is such a refreshing thing,"Anyone else noticed that on that last PS direct and both PS5 showcases that there were barely any first-person shooters? The variety of games on there is so damn nice, it shows a commitment of appealing to as many tastes as possible despite Call of Duty and Sports titles being the kinds of games that sell the most. The PS5 couldn’t get here any sooner, I can barely hold my excitement! Also, what launch titles do you guys plan on getting? I keep seeing Demon’s Souls and Miles Morales but Sackboy and Destruction All-Stars gets no love, I have a feeling that Destruction All-Stars is going to be a sleeper hit and Sackboy: A Big Adventure is also refreshing especially since LittleBigPlanet is my favorite PS3 game of all time. Anyways, thank God for this amazing lineup, and good luck to those who are still looking for a console!",t2_6cu42drr
"Sony Pictures are starting to brand some 4K Blu rays as ""PS5 4K MOVIE ESSENTIALS"" on the front of their box art (subject to change)",,t2_t03jh9i
"I only have a switch, I've always wanted to play the Ps4 classics. Should I get PS+?",:),t2_6760lvi5
"Is Peter Parker dead in the Miles Morales Game? We don't see him in the trailer, which isn't really the big issue. But in the gameplay demo we see a mural of some sort of Spider-Man. But then I got to thinking. They did the same thing in Far From Home when Iron Man died...",,t2_5rmoi04b
In light of the Souls specs we have seen released...,Would it be dumb for me to assume that it will support 1440 native?,t2_6yyzc4x6
After so much bad news lately Sony should show us a video of Bloodborne running at 60fps on PS5 without any patches to lift us up.,"Seriously, we are in need of some good news. We need to know how BC works on enhancing old games without patches. We need to see the monster SSD in action for old games.",t2_qo7n5
Could we see a digital trade in option in console gaming's future?,"It's not something I expect to see with this generation, but as consumers become more and more digital I fully expect in a generation or two to see consoles go the route of Digital Only.

With that in mind, I've thought about the possibility of the PS Store some time down the line offering trade ins. You buy a game at $70, and after you've decided you won't get any use out of it you have an option to delete it from your account forever for a small credit to the PS Store of like $10 or whatever. I think it could give incentive for players to spend more money with PS over the long term if they took this approach.

Am I crazy here or do you think some 10 years down the line this will be a possibility?",t2_16gnj5
I cannot stress how happy I am about a mute button on the controller,"For the past 7 years I've had to start a party to mute myself before getting into every. single. game unless I'm playing with friends. It's almost like an instinctive thing now.

Most games don't have a mute option and every earphone I use has a mic built in. Glad those days are going to be over.",t2_z3ankrk
I'm playing Bugsnax this week.,,t2_y5kl0
Spider-Man features on PS5: Are we still not getting native 4K 30FPS?,,t2_drt59
PS4 games that will get a free upgrade to PS5,"Better list:
https://docs.google.com/spreadsheets/u/0/d/1te_9VgoKOANR3uV8AVw1atpXKk-iC5199l8PhJBUAKA/htmlview 

This will be updated with time. 

For those wondering, the list below are all PS4 games that can be upgraded either digitally or via PS4 disk in PS5 physical edition. Some are digital only, TBD = To Be Decided. (date-wise) 


Assassin’s Creed Valhalla:
TBD

Borderlands 3:
TBD

Cyberpunk 2077:
November 19th, 2020

Dead by Daylight:
TBD

Destiny 2:
November 12th, 2020

Dirt 5:
November 12th, 2020

Doom Eternal:
TBD

Far Cry 6:
2021

FIFA 21:
Free upgrade before FIFA 22

Hitman 3:
Digital version only 2021

Horizon Forbidden West:
2021

Immortals Fenyx Rising:
TBD

Kena: Bridge of Spirits:
TBD

Little Nightmares 2:
TBD

Madden NFL 21:
Free upgrade before Madden NFL 22 launches

Maneater:
TBD

Marvel’s Avengers:
Holiday 2020

Marvel’s Spider-Man: Miles Morales:
November 12th, 2020

Monster Boy and the Cursed Kingdom:
TBD

NBA 2K21:
Only with Mamba Forever Edition

Puyo-Puyo Tetris 2:
December 8th, 2020

Rainbow Six Siege:
TBD

Riders Republic:
TBD

Sackboy: A Big Adventure:
November 12th, 2020

The Elder Scrolls Online:
TBD

The Witcher 3: Wild Hunt:
2021

Watch Dogs: Legion:
November 24th 2020

WRC 9:
TBD

Yakuza: Like A Dragon:
March 2nd, 2021

Grand Theft Auto Online:
Free for 3 months after launch. 

Source:
https://bgr.com/2020/09/28/ps4-ps5-free-upgrade-games-list/

Edit: added dates to some",t2_2dr247kq
"After a ton of research and trial-and-error, I compiled a list of things that helped me get a PS5.",,t2_c62os
Call of Duty: Black Ops Cold War Zombies to be revealed this Wednesday at 10am PT,,t2_f2sky
do you think its future proof ?,"im starting to worry by seeing few posts about resolution and fps choises .

but we have to remember we, are just starting this gen and we allready have to sacrifice

resolution or frames .

down the road im starting to worry if with future more damanding games. what resolution and frame we will have .

i personally think is gonna be a struggle to keep up graphically with others platforms

that  allready started this gen with a big leap in term of performances and graphics to up to 8k.

maybe im worried for nothing .

what you guys think ,",t2_dzxgu
[Video] PS5 Upcoming Indie Titles,,t2_fkqdb
43 Days of Appreciation: Favorite First Game at Launch/Purchase,Mine: First ever favorite purchase was Resistance: FOM for PS3,t2_24h2lsvu
"Unpopular (?) opinion: The ""jump between games at a moment's notice"" feature is completely useless.","Honestly, are attention spans that small nowadays that you have to have 6+ games loaded at once? (I'm 40 btw). When I start a game I play it like it's the only game I have until I finish it. This feature seems like overkill and a waste of resources.",t2_2cqznck
How long until we'll see Pro / Elite Controllers for PS5?,"How long do you guys think it'll take until companies like Scuf, Nacon etc. to design and produce new pro controllers for the PS5?

Been playing on Scuf for the past two years and honestly can't imagine going back to playing FPS titles without paddles again.",t2_11m8ou
i think konami is gearing up for a next gen mgs5 rerelease.,"they updated ground zeros, mgs5 and survive all at once, for stability reasons. but that feels weird considering the games are all pretty old, what did they miss that they had to update them all at once.

i think they are really gearing up for a rerelease and it even lines up with the recent although lazy rerelease of mgs1 and mgs2 on pc. i'm not optimistic so im assuming we have to pay for these updates/rereleases.",t2_1186en
"Sony is doing a sale for their Ready for PS5 and Perfect for PlayStation TV labels her in Germany, including a 50€ PS store credit.","For those interested in buying a new 4K TV for the PS5, Sony is doing an interesting sale for their Ready for PS5 and Perfect for PlayStation TV labels here in Germany. 

In addition to the sale, buyers get a 50€ PS store credit. 

I am not sure if it's available elsewhere, but it's worth checking for sure.

[Here's the link:](https://www.sony.de/electronics/angebote?cid=scp-eu-25646)",t2_y72uzb7
Yakuza: Like a Dragon physical copy also confirmed to get a free PS5 upgrade but save data won't carry over,,t2_34mqk70a
44 Days of Appreciation: Favorite Playstation Game Manual,"Mine: FF7

I thought the pictures were cool.",t2_24h2lsvu
Which game are you looking forward to most for next-gen?,What is the game you're looking forward to the most for next generation? Mine is probably Demon's Souls Remake.,t2_83uc1iz8
The real question everyone should be asking,Is the PS5 going to make the same beep that the PS3 and 4 do when you turn them on?,t2_13luka
"October 2019 Interview talks about the PS5's UI, and how Multiplayer and Singleplayer games will take advantage of it",,t2_t03jh9i
