title,post,author
Weekly Questions Thread - Ask about all things PS5.,"Use this thread to ask all your questions... like:

* What TV should you get?
* Is the PS5 backwards compatible?
* How much will it cost?
* When is the release date?
* Can I pre-order it now?
* Should I get digital or disc version?

Read a FAQ:  [All PS5 info](https://www.reddit.com/r/PS5/comments/h9iegq/all_ps5_info/)  

[Click to view previous question threads.](https://www.reddit.com/r/PS5/search?q=Weekly%20Questions%20Thread%20-%20Ask%20about%20all%20things%20PS5.&amp;restrict_sr=1&amp;sort=new)

[Twitter](https://twitter.com/RedditPS) | [Discord](https://discord.gg/KvutSum) | r/PS4 | r/PS5 | r/PlayStation",t2_3lp69av
"Media Posting is now ON (pics, gifs, videos) for while.","Hey r/PS5,

Things are a bit stale here so we're going to turn on media posting. That way you can upload images, gifs and whatnot. Please note, we still have rules and just because a post is in pic/gif form doesn't mean it can bypass the rules. Here a recap on a few of the rules that are most likely to be violated.

**Prohibited Content**

* Memes &amp; Shitposts
* Twitter reactions/A reaction from someone on the internet
* Commonly posted concepts
* Incites console wars/flamebait/pcmr
* Misinformation/Misleading posts
* Duplicate of a topic/issue/news that has already been posted

**Title Guidelines**

* Clickbait, editorialized, sensationalized, misleading titles, or attempting to draw attention to the post.
* Vague, generalised, unclear titles. Titles must describe the content of the post.
* Post about a specific game must include the name of the game in the title.

If all goes well, we might continue this but for now, let's give it a test run. We want to see how this impacts the sub before we decide to move forward with how media posting is handled here.

If you have any thoughts, ideas etc about how we can do media posts here or your thoughts on how it's going. Let us know in the comments!",t2_5r8xp
"PS5 skyscraper, Danik Mishanin",,t2_7uiztkip
We can officially say NEXT MONTH I am getting my PS5!,"We are really close... 
What feature or game are you looking forward the most on PS5?!",t2_z70q9
Spider-man Remastered Physical Edition custom case for my collection.,,t2_83g2a8o3
Banner Design Ideas,,t2_1l7h2qav
Spiderman PS5 vs PS4 comparison,,t2_g6xk6
"Housemarque's Returnal is a bullet hell, third-person roguelike. New images and info.",,t2_8jc6u
PS5 Box in Gamestop Austria 🇦🇹,,t2_146xdo
I'm dying to see the 3rd drop announcement,,t2_1yi38z9r
"Building the vast, mysterious world of The Pathless, out November 12 on PS5 &amp; PS4",,t2_423we
Anyone else just excited to replay PS4 games on it?,,t2_994n1
Sony should capitalize on gyro-aiming this generation.,"Gyro aiming is a way of minimizing the precision gap between controllers versus mouse&amp;keyboard. The use of gyro aiming doesn't replace the the right analog stick, but instead is used merely for fine-tuning. For those unfamiliar, here are a few videos illustrating in different ways its surprising potential for shooter games:

————

[\[Halo with gyro aiming\]](https://www.youtube.com/watch?v=mqaz6SxnwnI&amp;t=1s)

[\[Linus Tech Tips\]](https://www.youtube.com/watch?v=3qlZmXnE1mw)

[\[Motion Controls and the Rejection of Progress\]](https://www.youtube.com/watch?v=binPB4YbWmM&amp;ab_channel=Nerrel)

————

 Unfortunately, gyro aiming is often misunderstood. Here are common arguments I see against it, and why they aren't compelling:

**I wouldn't use it.** That's fine. But others would like to, and making it optional can leave everyone happy.

**It shouldn't be mandatory.** To my knowledge, no shooter has ever made gyro aiming mandatory.

**It would be expensive.** Gyro sensors are relatively inexpensive and wouldn't require any novel technology.

**It hinders accessibility.** More options increases accessibility.

**It's a gimmick.** Gyro aiming requires minimal movement and provides enhanced precision, unlike certain previous implementations of motion controls that have rightly been regarded as gimmicky.

**Not enough people care about it.** That's quickly changing as more and more people come to realize its potential.

————

On the other hand, there are good arguments in favor of gyro aiming. Most importantly, joysticks are intrinsically limited for aiming; gyro aiming enables a finer degree of precision. This

* fine-tunes the controls.
* enhances player agency.
* raises the skill ceiling without necessarily raising the skill floor.
* reduces the need to rely on auto-aim as a crutch.

————

One of the significant but underappreciated differences between the PS5 and XBX is that the PS5's controller enables gyro-aiming while the XBX's controller does not. However, there's been little effort by Sony to capitalize on this advantage. This is nothing new—the PS4 controller has a gyro sensor, but gyro aiming often wasn't even implemented in PS4's first-person shooters. This strikes me as a missed opportunity.

If you agree, I suggest reaching out to Sony via social media. The technology is already there—it's just up to Sony to take advantage of it.",t2_gxwjj
Crash Bandicoot 4: It’s About Time spins onto PS4 October 2 (PS5 BC),,t2_423we
Marvel’s Spider-Man Remastered detailed,,t2_423we
PS5 should beat these numbers based on Mark Cerny’s presentation,,t2_yg06u
November 19th PS5 users,Will you be avoiding this place when it launches on the 12th?,t2_jiudffg
"With all the talk around Peter Parker’s new face, I can’t help but think this would have been a more suitable choice",,t2_dvvr2
Crash Bandicoot 4: It's About Time - Review by IGN. New Clips of Gameplay,,t2_piauawq
"5 tips to prepare take off in Star Wars: Squadrons, out tomorrow",,t2_423we
"[Video] Override 2: Super Mech League - Gameplay Trailer | PS4, PS5",,t2_563ahk4e
New Cyberpunk commerical featuring Keanu Reeves played during the NBA Finals,,t2_1jyu7ksx
GT7 has a page up now..,,t2_145y89
"Cyberpunk 2077 Studio Head Responds to Mandatory Crunch Reports. ""This is one of the hardest decisions I've had to make, but everyone is well compensated for every extra hour they put in.""",,t2_g36qg
"That AD gets me every time I see it, like the console is coming out in 2 months and they still wanna use a fake mock up instead of the actual console? 🤣😂",,t2_58uhjc8o
[Cyberpunk 2077] Seize the day! (Mood for setting stuff on fire provided by @billieeilish . Fire ),,t2_655zc
Demon's Souls will have Two Graphics Modes: 4K mode and High frame rate mode,,t2_q9nqq
PS5 Ready,,t2_xrwwz
Marvel's Spider-Man | PS4 VS PS5 || Graphics Comparison,,t2_z70q9
DekuDeals type for PS,Is there a website similar to dekudeals that I use for NSwitch disounts available for PSN store?,t2_r1xaq
Detailed gameplay comparison Spider-Man PS4 PRO vs PS5,,t2_z70q9
Apple TV coming to the PS5,,t2_6wvu6gvm
The MotorStorm Trilogy Holds A Special Place In My Heart And I'm Not Even A Fan Of Racing Games. I Really Wish Sony Would Remake The Trilogy Or Make A New Game For PS5,,t2_way3z
What happened to dying light 2?,I remember it was delayed indefinitely but it seems like no one is talking about it anymore,t2_3ptbf336
(Unpopular Opinion?) There is absolutely not a lack of content or information coming from Sony,"First let me say that I've enjoyed hanging out on this subreddit during the build up to PS5 and I've seen some really great posts on here, in fact I changed from a long time lurker to poster because of this sub!

I must say however that recently (especially the last week), I've seen several people commenting that there's nothing coming from Sony and they're getting frustrated with the lack of info.

I'm not sure if its because I'm an older gamer (started on snes for reference lol) but this comes across as such impatience to me when I see it. Am I the only one still riding the hype from the showcase that was exactly 2 weeks ago? 

Not to mention the continuous blog posts giving more tid bits. Sure they've not shown the UI but what they have shown me is great looking games that I cant wait to play.

And you know what? I had no idea what the UI on any console I've ever owned would look like before I switched it on and I honestly think it adds to the wonder of using your shiny new console for the very first time. Surpises can be great! 

Apologies for the rant but this has been something that's really grinding my gears lately 😂",t2_akunh
What would you like to see from a PS5 superhero game?,Personally I'd like to see a Nightcrawler game to make use of the speeds/instant loading; a Daredevil game to really utilise the 3D audio but most of all - a GOOD X-Men game would be incredible.,t2_qww8xrg
Venom has now released solo and duel charging stations for the duelsense. Perfect for anybody who missed the official version from Sony.,,t2_e8ib6
Marvel's Spider-Man Director comments on Peter Parker's face model change,,t2_2jnhhhgi
Need for Speed: Payback and Vampyr are your PS Plus games for October,,t2_423we
Tempest 3D Audio Engine Tech,"Am I the only one who wants to get a taste of this audio? I know there are lot's of insane sounding hrtf vids on youtube.. but I would like a demo of the ps5 audio engine.
They had 6 standard hrtf's if I remember correctly.. so if they could make 6 videos each with different hrtf's with the same audio demo that would be awesome don't you think?! I'm an audiophile and I remember games that used 3d audio (with bad quality) back in the day on pc 😂 with a good sound card games sounded really insane.. I just hope it will sound like that but with way more sounds and way better quality (which will make it sound like real life)",t2_44mlfu
"Mystic comes through with an entire list of all ""free"" PS5 upgraded games, their upgrade path, and available specs.",,t2_37o6e23d
Spider-Man Remastered Content Released today is from an old build. Visuals have been upgraded,,t2_104l5b
"Sackboy Adventure inspired me to paint my own LBP crown. Thank you LBP for giving me a great community during my darkest times, when no one wanted to because I was being me. I've always wanted the crown since I Platinum LBP1 12 years ago. Here's hoping someday my sackboy can get one too.",,t2_hsa5q
HDR,"I’ve been wondering for a while now, games that give u an hdr option do y’all put that on? If yes or  no I would love to know your reasoning, also will you be doing this for ps5 games?",t2_34cc6khe
"High Quality PS5 Screenshots from (Returnal, Astros Playroom, RE8, GT7, Kena, Bugsnax, Scarlett Nexus, Horizon)",,t2_794wr073
"IGN: The PS5 pre-orders were the biggest event ever for us (in terms of affiliate links to stores from IGN) surpassed Black Fridays, iPhone launches (38:35)",,t2_794wr073
"The digital special edition of Sackboy comes with outfits for Connor (Detroit) Deacon (Days Gone), Sam (Death Stranding) and Jin (Ghost)",,t2_dw0ri
"You don't need Miles Morales disc to play Spider-Man Remastered. So just rent it from friend, buy Spider-Man Remastered and you are good to go.",,t2_15rrdk
Besides gamed what’s the most exciting thing about the ps5?,To me it’s the dual sense controller. I’m excited to see how it’s going to feel like using it. I hope it feels like a generation above the standard rumble for DualShock 4,t2_3sjiys4h
PS5 hands on tomorrow?,"I’ve been seeing/reading that reviewers have gotten their hands on PS5’s and should be able to start reviewing tomorrow. The only thing I’m not certain of is. Are they able/allowed to do a tear down and show us the inner workings or no? 

Sorry if this has been answered, but google hasn’t yielded any results.",t2_dkp13
3D audio when using the Dualsense audio Jack.,"I wanted to ask if a headset connected via the controller audio jack will support 3D audio.

Does the controller use bluetooth to connect to they system, because isn't there a delay when using audio via bluetooth?

EDIT: 

Like if the PS5 has to send the 3D audio to the controller over bluetooth, wouldn't the audio be degraded or of lower quality? Bluetooth doesn't allow for a lot of information to be sent.",t2_mwjik
PlayStation 5 Games Screenshots Eyecandy Collection,,t2_423we
Actual PS5 storage capacity,"So Sony advertises the storage capacity of the PS5 as 825GB, does anyone know how much of that will be available as storage? As in, has anybody heard anything about how big the OS is gonna be?",t2_16acv2
Dead Ops Arcade 3 confirmed for Call of Duty: Black Ops Cold War,,t2_f2sky
Black Friday/Cyber Monday,"Sorry if this is a dumb question, but do first party Sony games typically go on sale during BF/CM in the first year of them being out?

I noticed Ghosts of Tsushima is on sale for $45 right now, but I already pre ordered the PS5 DE, and since its launch is pretty close to BF/CM, I was wondering if I was better off waiting for a possibly better deal than what I could get right now? I really wanna experience GoT the best way possible, and that would mean waiting for PS5, since my basic PS4 can’t do 4K.",t2_xtpin
Watch Dogs: Legion launches 12 November on PS5,,t2_13j8me
"This dude got a sick tattoo, figured you guys would appreciate it!",,t2_4pswpfjx
Call of Duty®: Black Ops Cold War - Zombies First Look,,t2_7xtqf6xh
What Indie games would people like to see on the PS5?,I am hoping more indie developers will see the continued popularity of the PlayStation as a sign they should port their game to console.,t2_4uymhdoj
R&amp;C Rift Apart is up,,t2_794wr073
Returnal Page,,t2_krg3h12
Remember when everyone thought this was going to be the PS5?,,t2_z3ankrk
"I dont understand PS5 game pricing, why would you have such different pricing. Sony is making some big mistakes.",,t2_lzm4a
I absolutely loved this game. It was my first love on ps3. I really hope some people remember and see the awesome opportunity this game would have on PS5.,,t2_g8qjqd2
Stray Shares New Story and Gameplay Details,,t2_t27vp
Pre approved for a playstation credit card? Any one else get this?,,t2_1uk78mn1
Call of Duty: Black Ops Cold War Zombies – A new beginning,,t2_423we
Help me understand Ray Tracing (Spider-Man PS4 remastered) Honest question.," I'm not a pc gamer, so I'm not used to Ray Tracing. 

So from what I heard and know, Ray Tracing allow light to better reflects on surface and to create better reflection. (I can be wrong) 

And as you all know, today this photo of Spider-Man Ps4 remastered came to life. 

[https://prnt.sc/uqwfqv](https://prnt.sc/uqwfqv)

But I feel like there's something wrong.

With how high Peter is and that camera angle, is that normal to see all the street and the pedestrians below him? 

And also is Ray Tracing supposed to be ""like a mirror""? I mean is it supposed to have a 100% reflection of what is on the other side/angle? Is it too exaggerated in the photo or is this really what is Ray Tracing? 

I feel like this is just because it's the beggining of it on consoles so Devs doesn't have a standpoint (except on Pc)   


Thanks a lot for your time and have a nice day 🙂",t2_59vephne
PS5 HDR implementation,Is the HDR going to be better on PS5 compared to PS4? Are there better ways to implement HDR?,t2_xfc12
ASTRO's Playroom site is up - Screenshots inside,,t2_f5lxv
Getting your PS5 stolen in the mail or in person.,Anyone worried about their PS5 getting stolen from their mailbox or getting jumped in the parking lot? I preordered mine on a military base so I feel a bit safer walking out the store but seeing my neighbor's Walmart package outside his porch made me wonder if retailers will use discreet packaging during the delivery. What type of security measures will yall take on launch day?,t2_d0fk0
PS5 Countdown #GetHype,"[Live Countdown](https://yourcountdown.to/playstation-5) (North America)

[Live Countdown](https://yourcountdown.to/sony-ps5-world-release-date) (Rest Of World)

just like everyone else im super amped for the release of ps5 made this thread to talk among ps gamers exchange psn’s and just have a great time up until launch and beyond!! #playhasnolimits


Psn-Kvngxlos",t2_3hkg54il
CD Projekt Red is breaking their promise of no crunch and forcing a mandatory six day work week until release for Cyberpunk 2077,,t2_53d73b
"According to a WatchMojo poll, 65% of 60K people are intending to buy a PS5.",,t2_33577xsl
Slowly but surly,"This week is kind of funny. It seems like we are getting new information about PlayStation 5 stuff daily. But it seems like it’s not the information that we really want. For instance, I want to see the UI or the tear down of the PS5. For some odd reason I want to see actually gameplay of Destruction Allstar too.

What are you still waiting for?",t2_3vhahab0
Changing account region,"With the next gen is dropping next month what are our chances psn allows us to change our accounts region. I mean I went to school abroad when I originally created my PS4 account when that system first released. I find it ridiculous that I’m unable to change my account to my home country now that I’m living there. 

I know I must not be alone in this basic request to be able to change my account store. I’m unable to access any of my psn plus games due not being able to pay for things using a foreign credit card since it needs a billing address. Has any one been able to figure out a work around?",t2_f0cbmc6
Giving PS4 to SO when I get my PS5. Will anything change regarding games?,"So to be specific, I have a lot of digital games on my PS4 as well as paying for PS Plus. And I'm the primary user on the console with my SO having a secondary account

Will anything change when I upgrade to the PS5? Will my SO still have access to those games and/or PS Plus? Even though I'm upgrading to the PS5",t2_flbbt
Best Buy payment issues,"I’m confused because Best Buy hasn’t charged me for my console yet but they’ve charged me for everything else (separate orders). Is this something I should speak to someone about? Just want to make sure that I do indeed get my PS5 on launch day. 

Edit: I pre-ordered to curbside pickup",t2_5usre93
"If 99% of PS4 games tested work on the PS4, which were the games that did not work?","Surely this is interesting information to share. Though I guess, they are giving those dev's time to patch it if possible before release maybe.",t2_4idqq47c
"I was surprised when the trailer got uploaded in 1080p, so here's a full fat AI upscaled 4K60 version",,t2_6gfm4mkk
42 Days of Appreciation: First PS2 Online Game Every Played,Mine: My first ever game that I played on PS2 online was Tribes: Aerial Assault and then a Madden demo.,t2_24h2lsvu
Ps5 remote play on ps4 would be epic,"Exactly this, I could have the ps5 on my living room and play the games on ps4 if I'm in another house or in bed",t2_4r0aots3
"I’ve never really gotten into racing games, but with the PS5, and GT7 soon, I think it’s time. Any words of wisdom?","The game looks incredible and just wanted to get any advice about playing. In particular, is it worth it to get a wheel/peddle combo like the logitec g29, and/or a VR headset? (when Sony drops a new one.) any advice or insight would be most welcome. Thanks!",t2_nbvgr
All good things come to those people who wait,"Hello 

I hope you are having a safe journey through 2020. I have seen many posts regarding PlayStation’s silence and wanted to add something to the discussion. So here it goes: 

One thing I know from Sony and PlayStation’s marketing team is they are Marketing Gods amongst men. They know that selling something when it’s sold out is not the best idea. 

There is even a study from University of Alberta and according to them 

“An empty store shelf tempts shoppers to buy the next best thing” 

This means if they start advertising without any stock they might end up selling more of their competitors products. 

In addition, in my opinion PS5’s 

The Load times are better 

The controller is better 

The launch games are better 

The first year games are better 

The third party support is better

Backwards compatible first party games are better 

The UI is better (subjective) 

Also just saying combined with the two IO co processors the CPU is going to be better 

In addition with the cache scrubbers and the higher clock speed on the GPU is going to run better 

All in all just wait all good things will come to those who wait. Only 6 weeks to go. 

https://www.sciencedaily.com/releases/2009/09/090929133252.htm",t2_13cvoc
Yakuza lead suggests a Hollywood Yakuza movie “will only proceed if it’s really good”,,t2_oht8d
Bleak Faith: Forsaken coming to PS5?," I've been following this two-man development team for a year now and the stuff they have been showing of their dark RPG title Bleak Faith: Forsaken as been extremely impressive. So much so, even the folks at Unreal Engine have noticed them.  

Maybe there is a chance we'll see this dark Zelda-like indie title come to PS5? 

&amp;#x200B;

[I didn't even believe this was a screenshot](https://preview.redd.it/73y62qjo6eq51.jpg?width=3738&amp;format=pjpg&amp;auto=webp&amp;s=d53aa09b322607dcbdacd8b73f5d1819d3f094c6)",t2_jl8tb
Demon's Souls - New Screenshots,,t2_14cj835s
Here's part two of what Bloodborne could look like on PS5 (4K60),,t2_6gfm4mkk
NBA 2K finally confirms next gen version will be out Nov 12,,t2_i7y7n
not even close but i'm not that skillful,"&amp;#x200B;

https://preview.redd.it/zdg7ww3of8q51.png?width=2333&amp;format=png&amp;auto=webp&amp;s=884538658181c58cf5fd2dafa23d09385fe71f6f",t2_3v5os6sf
Why Cyberpunk's Mandatory Crunch Isn't Surprising,,t2_83uc1iz8
We are less than a month and a half until release and we still don't know what the UI looks like!,Like how hasnt there been any leaks yet? Sony really keeping everything locked up well.,t2_jexj4
Streaming off of a PS5,Does anyone know what the video quality will be like when I stream off of my ps5? I currently stream off of a regular PS4 at 720p and 60 fps. I’m hoping that the PS5 will at least let me stream 1080p.,t2_3opafxf3
"So, do you guys think we’ll get one last showcase before ps5 arrives?",I think they could have a short FAQ showing UI/compatibility/accounts/account migration/SSD expansion... what do you guys think?,t2_11724p
Dirt 5 won't be able to transfer your progress from PS4 to PS5,,t2_1jyu7ksx
Spiderman remastered,"Can we please get a 1440p 60fps version that runs on the same settings as the 4k30 one, so we can get the best of both worlds. Higher framerate and visual fidelity. I can‘t speak for everyone, but at a regular viewing distance I can‘t see a big difference between 1440p and 4k, but I can definetelly see RT reflections and more pedestrians/cars.",t2_yhiwh
Is Sony implying that not all headphones will utilize the spatial audio?,"Just saw this on the latest news about photo mode in Spiderman Remaster.

https://blog.playstation.com/2020/09/30/marvels-spider-man-remastered-detailed/


&gt; We take full-advantage of other next-generation PlayStation features like near-instant loading (don’t worry, you can turn back on those humorous fast-travel animations if you miss them), **Spatial 3D Audio on compatible headphones,** and the revolutionary DualSense controller’s haptic feedback and adaptive triggers

Doesn't this imply that you might need special headphones to get the spacial audio?",t2_6npej
Anyone else disappointed we haven't gotten a teardown yet?,"Even though Cerny mentioned it way back in The Road to PS5. We are about a month away from the launch, and I'd like to see what I am getting. It feels like they are still scared of its size maybe, and dont want it shown in peoples hands.",t2_7znuz34
PS5 Launch Games,What launch titles are you guys most excited for? Or shortly after launch? Interested to hear your thoughts I couldn't pick a stand out 3,t2_qb6at
Very interesting info on PS5 - AMD RDNA 2 : Navi is on the rise | RX6000 Launch Preview - [Video],,t2_13cvoc
Returning Console Owner,"The PS5 will be the first console I've owned since the PS2. I plan on buying the Digital Edition since I don't already have any games.

I was curious which titles from the PS4 I should buy on day one. I've done a bit of research, and I think I'll be getting The Last of Us, Watch Dogs, Tomb Raider, and Hellblade pretty early if not day one. Just, wanting to know others' opinions on the best to reintegrate myself into console life.",t2_84ant27o
Could Sony be hurting itself by staying quiet?,"Hello everyone,

I was just thinking does anyone think the lack of communication from Sony is hurting the brand and PS5? There are a lot of articles being written about backwards compatible and other issues that have not been addressed. Does anyone think Sony is doing a disservice by not making statements? Or is its lack of communication good to build hype? It feels like the launch of the ps5 is so close but there are still so many things we haven’t have confirmed about it. Does anyone think this is a problem or does it really not matter?",t2_5sl20xyf
On PS5 installs and update lag will be a thing of the past?,"Just kind of occurred to me, and sorry if this is been mentioned before.

Picture the scene.. It’s November 12th (or 19th) your PS5 is unboxed, it boots up, you follow the set up and then BAM, day one system update, (boo!)

Well as much as this and game patches were annoying on PS4 having to wait for install, because of the blazing SSD (Cerny Preach) hopefully we’ll all be up and running with our PS5s pretty fast (or better yet.. background updates!?)  *Good internet required*",t2_7eebvuwi
ACE COMBAT 8...With Dualsense?,,t2_855d7hyn
Game Sharing confirmed?,,t2_x0yit
Hope Demon's Souls Remake keeps the same Cat Ring icon from the original game,,t2_bsgbt
This is by far the best example of the insanely fast SSD in action,,t2_634bs76i
Games of a Generation promotion comes to PlayStation Store,,t2_423we
Downloads Nov. 5 on PS5?,,t2_5gal6g4c
"This is the game I'm most excited for, anyone else?",,t2_29mmkvyw
