title,post,author
Waiting at 5AM until 12PM to get my PS5 secured at GameStop was honestly one of the most fun and memorable experiences I’ve ever had. And here are my tips if you ever decide to camp out for one.,"As the title says, I’ve managed to secure a pre order at my GameStop to get my PS5, and I still can’t believe it honestly. Because I know this will be a low availability item, here are my tips on how I got mine and how the wait for it was even more bearable.

1. If it’s been announced that there will be some in-store, call them and get as much concrete information as you can. Find out how many they’ll have available, if it’s okay to start a line overnight, what they’re store hours are, etc.

2. The most important thing you need to know about camping overnight for a console is that you need to have the guts and determination to do so. Don’t show up at 6AM thinking that you’re going to get one, because trust me, there WILL be people who are more determined to secure a console than that. In New York for the Nintendo Switch, there are people who would wait literally 2 days straight to be first in line to get theirs and to meet Reggie and Doug Bowser. Even if you live in a small town, be ready to get there at least 8-9 hours early. I live in a small town and I showed up at 5AM and I was the last one at my GameStop to get a PS5, but not too much longer after I arrived there were waves of people showing up, so I got very lucky and showed up at the perfect time. There were 5 PS5’s available, the first guy showed up at 1AM, 2 guys showed up at 2AM, the 4th guy showed up around 3AM, and I showed up at 5AM. Do not rely on living in a small town to guarantee that there will be any available because news gets around fast thanks to the internet.

3. Alongside determination, a lot of people just simply don’t have the time to camp outside stores like that due to having to work, take care of kids, etc. The only reason you should make room for doing something like this is if you are really determined to get up really early and commit to waiting for it, don’t think you can squeeze it in without making room in your schedule for it.

4. Befriend the people you are waiting in line with. It’s going to be a long wait, and how much these people are willing to be cordial with you is really what’s going to determine if the wait is going to be agonizing or fly right by you. Bring multiple chairs, one for yourself and some to offer others should they forget to bring one due to them rushing over to the store and forget to bring their own. If you want, be willing to buy or offer them some snacks and drinks, and most importantly, set up this bond that ensures that everyone waiting there will have each other’s backs should anyone need to use the bathroom. Joke around, engage in conversation, and be charismatic to make sure everyone feels comfortable with you. You’re all going to be waiting at least 6+ hours together after all, no reason to let things be awkward. And believe me, everyone will want to, no one wants to sit there for hours next to a guy who’s unfriendly and keeps to himself the entire time. 

5. This actually brings me to having to use the restroom or wanting to get something to eat. If you do leave, depending on how big the line is, don’t be gone for too long, 15-30 minutes tops. You just look like a dick being gone for so long lol, and it’ll be awkward for everyone else saving your seat. Now, if you have a friend or relative who’s willing to drive to your location or wait with you then that’s awesome, but if you don’t just make sure you don’t take too long.

6. My final tip is actually for before you have decided whether or not to go through with waiting in line for a long time. I’ll say this, I wasn’t going to go either, but something just told me “fuck it, if there aren’t any then just go back home”, but I’m telling you, that feeling of knowing that you absolutely will get your console, all you need to do is wait, it will HEAVILY outweigh any doubts you have about waiting anymore, you’ll be too happy to even care lol.

And there ya go! And remember if you aren’t able to secure a PS5, eventually you won’t be able to go into a large retailer without seeing them everywhere, so don’t lose sleep over it. Good luck to you all!

EDIT: Also, one thing I can’t believe I forgot but should be taken very seriously when deciding whether or not to wait in line, make sure to bring comfortable clothing and check you’re local weather! Bring completely charged electronics &amp; of course wear your masks!",t2_6cu42drr
PS5 should let you set Home Screen music,"You know how you get the game soundtrack for certain digital deluxe games like The Last of us 2 and Ghost of Tsushima? Well why not let us have a song from that soundtrack play when we boot the system up, you can even set it shuffle to have a different song play every time you start the console.",t2_52znegse
PS5 Wishlist Function,One thing I would like to see in the digital store for the PS5 (or just in general if it's the same store as PS4) is a wishlist function. Being able to get notifications if a game goes on sale or releases etc would be handy. Anyone else think this would be used much?,t2_jqozl
"[Video] Dynasty Warriors 9: Empires - Teaser Trailer | PS4, PS5",,t2_563ahk4e
Does anyone else miss the classic colors for the buttons that won't be on the DualShock/DualSense 5?,"I've already missed the classic Playstation colored logo for years, and now the button colors are leaving. Oh no. Very sad",t2_5hqpmjsr
"Honey, guess what",Guys/girls in a relationship. How did you break the news (spending 500$) to your beloved one ? And how well (or bad) it went ?!,t2_hy9yk
What Is The Benefit Of Hiding Anything At This Point For Sony?,"I mean the PS5 is sold out everywhere already, just show us the UI, PS Now improvement/bundles, more info about PS Studio games and a hardware breakdown/ a hotchips like event etc. Honestly don't see any benefits of the SOONY moniker anymore",t2_7j6m66hd
"DualSense ""Night Mode""","This should definitely have been a thing...I really do not like how they took the classic button colours away, wish they would add this! I will def be waiting to buy a second controller which features the classic colours, but I really wish they incorporated this into the original controller, battery draining or not, it'd be awesome!

[https://insiderpaper.com/ps5-dualsense-controller-night-mode/](https://insiderpaper.com/ps5-dualsense-controller-night-mode/)",t2_42lbw465
What if Blue Point adds the last archstone with the deamon souls remake?,"I remember back on ps3 wondering if you had to do something special to be able to activate the broken archstone then i found out it was just cut content called ""the land of giants"" what if with this remake Blue Point Games actually finished and added this level? I think it would be amazing especially since the level design and characters were in the original game files anyway",t2_e1ybl
Bloodborne absofruitly needs a PS5 patch,,t2_6gfm4mkk
Ratchet &amp; Clank is a real showcase for the SSD,"The instant transitions between completely new environments is a huge huge deal. We've never seen anything like that before, in any game, on any platform.

I wasn't expecting it so soon but it seems we got a showcase for the ""new gameplay opportunities"" that the SSD brings pretty early on.",t2_885c8wc3
Why I think we'll see more 1st Party MP with next gen.,"With the anticipation for the TLOU MP I couldn't help but remembering 2yrs ago [Shawn Layden suggesting how much they will now invest in first party multiplayer titles](http://gametyrant.com/news/shawn-layden-wants-more-first-party-multiplayer-games-on-playstation) and I strongly believe TLOU MP will be the first of many:

&amp;#x200B;

&gt;What we don’t do so much in is multiplayer.  
&gt;  
&gt;\[...\]  
&gt;  
&gt;But, no, I was referencing more with the things like “GTA 5 Online,” or you look at “Call of Duty,” or “Fortnite,” or any of those experiences. Worldwide Studios, like I say, we’ve been going really heavy into story-driven gaming. The power of the narrative. Big, spectacular experiences. But not a whole lot in the multiplayer side of things,  
&gt;  
&gt;**I think that’s an area where you will likely see us start to make more noise in the new term**.

&amp;#x200B;

Sony haven't seriously dabbled in the MP scenery, I mean yeah we had Killzone Shadow Fall, Driveclub but they were quickly forgotten.

That quote was 2yrs ago and I suspect things have already been in motion at WWS, perhaps that new SOCOM game isn't that unbelievable, a new Resistance or even bringing MAG back!

Seeing the amazing quality of PlayStation's 1st parties in the past few years I can only imagine what dedicated 1st party multiplayer titles would look like!",t2_bvwb3
"As we're all waiting for GoW Ragnarok, watch ""Raising Kratos"" if you've missed out so far",,t2_d83llav
The PS5 is sold out and there are still a lot of things we don't know.,,t2_1094i1
I would love to see Warhawk on PS5,Who was around on ps3 for warhawk? One of my favorite all time games. I also loved Starhawk even though it had its issues. I would love to see a remake for ps5.,t2_10z8hn
PS5 should have an option to clean the heatsink/fan without tampering warranty,"As we all know ps4 was a culprit of fan sound due to dust settling on the fan fins and the heatsink, Sony should  think of the option to clean the fans/heatsinks without tampering with the warranty

What do you guys think?",t2_edtfig0
Travis Scott has the PS5 already,,t2_4f4vai7o
47 Days of Appreciation: Favorite Playstation Startup Sound,"Mine: PS2 

It's so nostalgic and awesome in every way. Second runner up is the PS3.",t2_24h2lsvu
i sincerely hope Sony will set new milestones with the PS5,"they already had amazing games on the PS4 (God of War, the last of us 2, Uncharted 4, etc.) but what i want to see are completely new IP's that stand on their own and become a potential succesful series and not a continuation of already existing games.

i hope Returnal will be one of those games and not a One-Hit Wonder",t2_licsl
Who's hyped for this week,"Some youtubers will have the ps5 hands on and playing some of the exclusives.
Hopefully we will see the UI",t2_4qimy14p
Custom controller profiles for each purchased game,"Not all games allow you to remap your controls and that could be frustrating. So, it would be nice to have a feature that’ll allow you to set up custom controller profiles for each game.

Settings that’ll allow you to remap your controls (like pressing X will perform the O function in game) along with additional features such as vibration settings or strength, volume for controller, dead zones, etc.",t2_3ab2apul
What We Do &amp; Do Not Know About The Playstation 5,"Updated 27 Sept with some of your comments.

Just thinking aloud here, I figured we could chronicle some of the known and still-unknown topics about the Playstation 5.  Perhaps we could update this document as new details emerge.  Feel free to chime in on items I've missed. 


#Things We Do Know

Just a modest list of things of which we are certain.

##*How Will Backwards Compatibility Work?*

&gt;99% of Playstation 4 games will be playable on the Playstation 5. ([Source](https://www.washingtonpost.com/video-games/2020/09/16/ps5-retail-units/))

&gt;The exact list is not currently known, though it's likely that any games that require specific peripherals (or something like that).  

&gt;It should go without saying that if you have a Playstation 4 disc, you *will not* be able to play it on a Playstation 5 Digital Edition.  

&gt;As for Playstation 3, 2 and 1 - none of these platforms are currently supported by backwards compatibility (except through current PS Now. 

&gt;Will all these games be available at launch? Another mystery! 


##*Which PS4 Games Will Have Available Upgrades For The PS5?*

&gt;[Push Square has a good list](https://www.pushsquare.com/guides/ps4-to-ps5-all-games-with-confirmed-free-upgrades).  This shows which games have free upgrades and what those details are.

##*And What About Controller Backwards Compatibility*

&gt;Playstation 4 controllers *will* work with the PS5.  However, they will *only* work with PS4 games.

&gt;For all Playstation 5 games (currently known), a DualSense (i.e. PS5) controller is required.

&gt;Will Playstation 5 controllers (DualSense) work on Playstation 4 games?  Currently unknown.

##*Will PS VR Work With PS5?*
&gt;Yes.  It will, however, require some sort of dongle adapter.  That adapter will be free, but [we don't know how to obtain that or how it works](https://www.pushsquare.com/news/2020/08/ps4s_camera_will_require_a_free_adaptor_for_ps5).


#Things We Still Do Not Know

I look forward to learning more to make this list diminish over time.  

##*Video Output: 1080/1440/4k*

&gt;Both Microsoft and Sony have touted 4K visuals but many don't have TVs supporting this.  Will games be available in 1440P?  We're not really sure, and I think this will work on a per-game basis (i.e. up to the developers).

&gt;The reason this is a question (for those curious) is that many people play on monitors rather than TVs.  In addition, while the PS5 *can* offer 4k @ 120hz, very few TVs offer this.  1440P @ 120hz is more common.  We're just waiting for Sony to confirm what's what here.

##*Will We Be Able To Suspend Games?*
&gt;One of my favorite PS4 features is the ability to put sleep mode and return to a game quickly later.  The newest Xboxes will be able to suspend more than one game at a time.  Sony hasn't mentioned anything about this feature on the PS5.

##*How will Playstation Plus work?*

&gt;This will likely work as it has in the past: two free games for each system.  Cloud saves and online multiplayer will be locked to the service.  

&gt;&amp;nbsp;

&gt;The PS Plus Collection will be a great perk for owners/subscribers, offering at least 18 games for download.  [[More Info on the PS Plus Collection Here](https://www.pushsquare.com/guides/all-ps-plus-collection-games-on-ps5)]

&gt;&amp;nbsp;

&gt;But beyond this, we don't know if any other changes will be made.  Pricing should remain the same.


&amp;nbsp;

##*How will PS4 save games carry over?*


&gt;Best guess?  Cloud-based saves should be automatically detected by the Playstation 5 and downloaded accordingly.  

&gt;&amp;nbsp;

&gt;For remastered games (currently *Spider-Man*, perhaps others), save games **do not carry over**.  For PS4 games,   

&gt;&amp;nbsp;

&gt;Will we be able to move save games from PS4 -&gt; USB -&gt;PS5?


##*Will PS Now see any changes?*

&gt;They've told us very little about PS Now, but they *will not* be moving towards a model like Microsoft's Game Pass.  New games will not be available through this service and no new titles will be added to it for the PS5's launch.  [More info here](https://www.gamesindustry.biz/amp/2020-09-17-playstations-jim-ryan-we-want-to-give-gamers-certainty-that-theyre-buying-a-true-next-generation-console)

##*Will You Be Able To Activate A PS4 And PS5 Simultaneously?*
&gt;This is a unique one.  With games being available on both, Sony *may* not allow this to happen.  A quick example would be me selling my PS4 because I have a PS5, however my old console is still activated as my primary device.  The new owner could use all of my games despite not having purchased them.  

&gt;This is why I think you'll have to deactivate your old device - but that's just a guess.",t2_civ38
Evolution of Five Night's at Freddy's (FNAF) (2014-2020),,t2_4ywg1qf0
"The Last of Us Day website now live, no Factions 2 or PS5 announcements so far unfortunately",,t2_yyjgw
God Of War Remastered?,Do you think they will bundle God Of War PS4 with Ragnarok? Like they are doing with Spider Man,t2_77t4i0si
RDNA 2,"https://twitter.com/alejandroid1979/status/1309972623594606593?s=21

This was leaked",t2_6wqc88l9
What little things (like the UI) are you hoping for?,For me I really want Sony to integrate a better app. It should be wayyy easier to automatically send pictures/clips to your phone.,t2_rs82ptw
PS5 Specs - PlayStation 5 Tech Explained,,t2_ct01hbl
Will The Upcoming Astro’s Playroom Have The Option To Delete It Unlike The Current One On PS4?,Will The Upcoming Astro’s Playroom Have The Option To Delete It Unlike The Current One On PS4? And also how long do you think the game is gonna be,t2_75s4ecwd
Which Headset are you Guys Going With?,"I was pretty dead set on the Pulse 3D, but now I'm sort of leaning to the Astro A20's. 

What do you guys think? and also, what everyone going for and why?",t2_gtipv
"So my bro wants CyberPunk (has PS4), as do I but want to wait until PS5 version comes it, still worth getting it now?","So my little bro isn’t going to get a PS5, so is sticking with a PS4 until he saves up to build a gaming PC. I’ve pre ordered a PS5.

Now the thing is, we both want to play cyberpunk. But I don’t want to play until they release the PS5 version. So I won’t be playing now.

Would it make sense to buy the game at launch for PS4, and then loan it to my little bro to play. And then when the PS5 upgrade comes about, start playing it myself then? Would that work? Do I need to be careful about registering to my account first or something?

We’d likely split the cost of the game.",t2_3setnc5e
I made a sizzle reel of some of my most anticipated games coming to PlayStation 5!,,t2_5c05s
What are must have games at or around launch?,Thinking Demon Souls and Miles Morales. Anything else look “must have?”,t2_15yyqe
Demon Souls Ganeplay.,"The gameplay we saw was at 1440p/60FPS
I think thats awsome since we got High Quality Textures and Assets. (And its the most Next Gen looking Game)

What do you guys think about that?",t2_4jmwhxtl
Starfield Leak(allegedly &amp; not confirmed) Pics,[https://imgur.com/a/GSWTkHn](https://imgur.com/a/GSWTkHn),t2_akz8y2t
Whats one game you would gladly have remade for the ps5?,For me it would be The Suffering! That’s a sleeper hit I don’t hear many people talk about.,t2_2v2bebtv
Games that made you emotional?,"Alright boys and girls, which games actually made you very emotional? I am asking, because a game that makes someone emotional usually suggests a very well written story line or a big emphasis on character development. And i am looking for those kind of games, therefore don't spoil major plots or at least use the spoiler tag :)

The most recent game that made me emotional was Red Dead Redemption 2, and its a game i never thought would make me feel that way.",t2_etkui
How likely is it that GoW Ragnarok will be a ps5 exclusive and not cross gen,"A lot of people on the PlayStation discord think it’s going to be cross-gen but I believe Sony wants to accomplish things not possible on ps4 with the ssd, like between realm fighting, and stuff like that. Is it more likely that’s it’s going to be exclusive to ps5 or do you guys think it will be cross gen",t2_4e4x86rf
"Nippon Marathon 2 Is Apparently Getting a Kickstarter (29th on) (I'm unrelated, just a fan)","So while everyone is playing Fall Guys, I have been playing for the last year or so+, Nippon Marathon, it's honestly Fall Guys on crack (but came a lot earlier), being like this weird japanese game show but reality thing where there is a humanoid dog in a shirt and scarf battling an old japanese man in a school girl outfit, etc. I really liked it, and I had found out that there is going to be a kickstarter for this game on the 29th, and it's apparently getting physical (which implies console release, and they even kind of point out that in the info), and like, I'm so damn ready for this beautiful jank mess of a game to hopefully get a sequel.

First game:

[https://www.youtube.com/watch?v=DLg-TxkJIuM](https://www.youtube.com/watch?v=DLg-TxkJIuM)

&amp;#x200B;

Idk, seemed worth mentioning, I probably plan on supporting the kickstarter, and I'm pretty excited after finding out about it post playing on it (on pc) with my friend (remote play anywhere, ie we social distanced)

&amp;#x200B;

Anyone else a fan of the first one? I for one am excited for a sequel, though I hope they don't try to jack of the graphics above their talents, and it hurts the game itself (like trine 3, rip)

&amp;#x200B;

[https://www.kickstarter.com/projects/onionsoupinteractive/nippon-marathon-2](https://www.kickstarter.com/projects/onionsoupinteractive/nippon-marathon-2)

&amp;#x200B;

This isn't promotional, I have no relation to this product, heck I don't even know what country this game was made in, I just love it, and it seemed worth noting that it's getting a kickstarter (especially since the first game was pretty great for couch co op, which is a dying breed sadly)",t2_1ff828s4
New pulse vs the older ps4 version with 3D sound.,So about a year ago I purchased the new (at the time) 3D audio Sony headphones. Will they be just as good as the ones for the ps5?,t2_16evn3sc
According to this website the PS4 hit 2.1 Million units sold within the first 15 days. Do you expect the PS5 to do better?,,t2_17fa8t
"To be honest guys, seeing the prices for the PS5 games almost take the fun and excitement out of me to actually enjoy them","If it becomes the norm to pay 80€ for almost every game then it would take the fun out of it.
when I play games I would always have to think about how expensive it was for maybe 20-30 hour of gameplay",t2_licsl
I hope PS5 will allow us to do this.(regarding save scumming),"on PS4 if you want to back up a save to USB you have to close the game to do the back up task, that's really irritating especially when you go after 2 or more conflicting Trophies (i.e. Endings) or when forging an equipment which have RNG skills and you are looking for a specific skill on that equipment until you're running out of resources if you didn't get what you want you can go to your backed up save. i know PS5 can boot up games fast and i'll be where i left the game in few seconds after backing up my save but still doing that without shutting down the game is more convenient for us Save-Scummers.
Sorry for any grammar mistake, English isn't my mother tongue.

TL;DR i hope PS5 allows us to back up saves to USB while the game is still running.",t2_11qhec
Am I the only one hoping for the ability to delete trophy lists if you've earned say less than 10% of the trophies for a game?,"I'm really hoping for the ability to delete trophy lists if you've earned a certain percentage or less in a game. You'll occasionally buy a game, realise it's not for you, then consign it to the dust never to be played again. Problem is you've earned a trophy for it and now it's stuck in your trophy list forever at 1%. Maybe this is just my inner perfectionist speaking and it's probably just a pipe dream, but one can only hope.",t2_8n3a9uv
"Tom Warren (The Verge) may have his hands on a PS5 - tweeted a picture of his Xbox Series X setup, and there's something in his TV unit PS5 shaped.",,t2_56zevht
How the PS5 would fit my current setup.,"[https://i.imgur.com/rMn0ib1.jpg](https://i.imgur.com/rMn0ib1.jpg)

Props to Spellmansp for the PS5 3D Model: [https://sketchfab.com/3d-models/sony-playstation-5-5833f3516db442eaa2ef33702c110ae8](https://sketchfab.com/3d-models/sony-playstation-5-5833f3516db442eaa2ef33702c110ae8)",t2_1d0orf9
When Sony says “Cinematic and Gameplay footage has been captured from ps5 system”,Do they mean using the built in recorder of the ps5 or are they using some device to capture the gameplay on ps5?,t2_64f2a2fv
Atelier Ryza 2: Lost Legends &amp; the Secret Fairy Trailer PS5 version at no additional cost from PS4 upgrade,,t2_k899j
I want to see people open up their PS5,"I'm curious to see the internal differences between the digital and the disc versions. I opened up my PS4 last week and the disc unit is massive and now I'm wondering what implications/benefits its absence could bring to a console. Smaller, more efficient or quieter fan, smaller power unit, ease to clean up is what I can think of without much effort. They could even leave a spot to add a second SSD, which is very unlikely, but it would be awesome.",t2_16j7vb
Can I use my Scuf for Call of Duty Black Ops: Cold War?,"So I know the Duel Shock 4 controller will not be compatible with next gen PS5 games, but Cold War is going to be released on PS4 as well. Does this mean I can use my scuf to play Cold War on PS5? Or am I only going to be able to use it on the Warzone game mode? I’m hoping that since it is being released on PS4 that I can still use it.",t2_7jsr3ay8
With the PlayStation+ Collection being PS5 exclusive there’s a chance games will be enhanced.,"I’ve been thinking, since the collection is for PS5 only the games would probably need to have an optimization patch. Meaning older games like my all time favorite Bloodborne should have better frame rates at the very least. 

Do you all think this is far fetched to assume? 
My main reasoning for this speculation is the fact that “PS+ collection for ps5 only” should equal to games in the collection enhanced in some way to utilize the PS5’s capabilities.",t2_61ga2z81
"After buying the back paddle attachment for the ps4 controller, I literally can't go back to playing fps games without them. What can I do when the ps5 comes out?",I was very disappointed seeing the new controller without them. I am so used to them now that a regular controller just inhibits my abilities.,t2_5lv72
"Admit it, you’re going to miss seeing this intro every time you boot up a PlayStation exclusive… that subtle moment when you *know* you’re about to experience Greatness.",,t2_7xq185dk
